{"batch_id":"nls3_batch_001","body_free":true,"case_commitments":[{"case_commitment":"edaa674852ece02333b504e279999f711f3e6a37aef4ea03f2ecb6e9c007b67c","case_id":"nls3s_b001_0001"},{"case_commitment":"56525717f0c64d882d3f48f5c04494eef946d2d532196f3893c04572b0f1d122","case_id":"nls3s_b001_0002"},{"case_commitment":"01481cb0b1b014094482f2e3ce7bafa5fd459a211e972c5a0b9934000f15fb2f","case_id":"nls3s_b001_0003"},{"case_commitment":"d9489a89483e0dc2f5567489c0d018e622ed0d6db9c5a1546be21bc91c204de6","case_id":"nls3s_b001_0004"},{"case_commitment":"b2fe5de1b2ac9132b13b2f8df21f53b9ca9364208bb09d6e7d875424fcac2934","case_id":"nls3s_b001_0005"},{"case_commitment":"7db2db2d249ff53817ed7d299afbf3df17108296ed3bf0542e8a170de749a410","case_id":"nls3s_b001_0006"},{"case_commitment":"24844ae975d6cf0dfa78e2a770f4c7135dfc29c597557c131abb96b360f34dd4","case_id":"nls3s_b001_0007"},{"case_commitment":"7a7d15bf2f8513808afc6c3144cbf122b2a2b59838b51283f26dd1af80a7ce4d","case_id":"nls3s_b001_0008"},{"case_commitment":"8a5c4a0d4a1c25df4313906f83b420e7d9e952edb5263df4567e8bda6c73a0e9","case_id":"nls3s_b001_0009"},{"case_commitment":"4ae1835f0c15228becee4b1be740a44d18693d2833b799c3670ce5825129ed09","case_id":"nls3s_b001_0010"},{"case_commitment":"e4b664e1d8edfd29adc40e173cac0642299eddcbe6218a2e25162df2389ccfcf","case_id":"nls3s_b001_0011"},{"case_commitment":"d506804ca331355853916003775c6da7d8a276f955b1a411c463dcc0c6090abc","case_id":"nls3s_b001_0012"},{"case_commitment":"c38c994715cc6bdb33adaae851f753d2d3b42634161de2fe9ae44519f94cdc04","case_id":"nls3s_b001_0013"},{"case_commitment":"7727da60bbb732c161cb36ec571bce61e4fc55d9f64dfc1c97a6632209864238","case_id":"nls3s_b001_0014"},{"case_commitment":"9b16d152350115494841c81f30e9201147d558156bdbcdc812dfe6bd9f27749e","case_id":"nls3s_b001_0015"},{"case_commitment":"041863fa5f6e5927673cdb9603acb90a70d78822555902e613a8164ad69e499f","case_id":"nls3s_b001_0016"},{"case_commitment":"5e3a1967af690f9c8c97dd2b5a81680d83f38999d21da2291e1767275fcb854f","case_id":"nls3s_b001_0017"},{"case_commitment":"bacd12c9554bd0f6aaddaa37d5fca7d66ea1a1de16a2c590b69a07b8be18687f","case_id":"nls3s_b001_0018"},{"case_commitment":"7f5ab505800c49ceb15179cf434ad12dec5129046b1b3e625e4e41bbe1331f8a","case_id":"nls3s_b001_0019"},{"case_commitment":"8a5ec82153e891a9bb9d8a93ea20be75e9099299f76cee5891d4eae9efc4d315","case_id":"nls3s_b001_0020"},{"case_commitment":"5b3996e72cf42f778b698ff4f8c450481d8eb7c5f3c04325ad7f8e3dcaf9ca01","case_id":"nls3s_b001_0021"},{"case_commitment":"1ded8b9c12ef82513fdcd021a8debf1bbdeea76b5778effa2a999e7dc91736df","case_id":"nls3s_b001_0022"},{"case_commitment":"9e33ec15dfa855fc6f2763cdd945dfd87335cca736878647953982bcbb3973d7","case_id":"nls3s_b001_0023"},{"case_commitment":"1577b39f0ee694b5955f9955f1fac43631bb2f710c80f75ac97d482862601572","case_id":"nls3s_b001_0024"},{"case_commitment":"28485181312eccc72efac1fb8ad5d2f7b27e7aed349f397e63bc88d4504a7ef4","case_id":"nls3s_b001_0025"},{"case_commitment":"3b30caa835497ae4796d6bd2335c550d61a313ebff3601bde60e537c0d6a67ed","case_id":"nls3s_b001_0026"},{"case_commitment":"d7b45288afa5cfc86e65acfa72da1d9ae02c8f97cd330d1f1299bc673a399967","case_id":"nls3s_b001_0027"},{"case_commitment":"09487a1b4c3d9a35b3d093858a934d3a5952982cdc30cfcfec1e4c14250e82c8","case_id":"nls3s_b001_0028"},{"case_commitment":"7d9f058c43b99e07bbef273f4a277da4369c12ae238e3dec751cec5bcec5eb51","case_id":"nls3s_b001_0029"},{"case_commitment":"fdb4928f8cc289c4f9e3307b6b9ff44db2e6451d2ca6bbdd627f66d8043bef2d","case_id":"nls3s_b001_0030"},{"case_commitment":"60ab5a5a4a3a6261a2ad704ca3d5769d2763025999435ed342d9930eb70330bd","case_id":"nls3s_b001_0031"},{"case_commitment":"65a945eda25cc1141ca9e974d4637ddc05b9edc731d1338a31716c8da88ca94c","case_id":"nls3s_b001_0032"},{"case_commitment":"9e623b61e237e273733542f5b9ff75c6284deda5972b6980b45ea4c9dfc20b57","case_id":"nls3s_b001_0033"},{"case_commitment":"1de8f8697c498833f637e5476f91391d5726b985dbbd159c78bf8e41833be2dd","case_id":"nls3s_b001_0034"},{"case_commitment":"5d28a368fa9758c1635d5a68e52ee6fbee78a7be802bc71e75506e224d88c6f4","case_id":"nls3s_b001_0035"},{"case_commitment":"a609e54f3ebc90a879f4e8b76973ca8dab9b240472db8ed9f6806cbaaa1c8a0f","case_id":"nls3s_b001_0036"},{"case_commitment":"da213829193109ce361ec60778947d05cda0231a48a6773033cca3f05e8268d1","case_id":"nls3s_b001_0037"},{"case_commitment":"90b805d4530d17507e5ba8fea1b71aa90e89d06c20a9e3429e6ea9784f7824c7","case_id":"nls3s_b001_0038"},{"case_commitment":"ed9913add07d39703acdc1805732b100dda5bf9d452bb758980b6ed4e2710671","case_id":"nls3s_b001_0039"},{"case_commitment":"28d52acaa4f05db1cd0ea097242801dd864ae8e5209c7f068f6919cdf01bc0f5","case_id":"nls3s_b001_0040"},{"case_commitment":"1e4ee090587b856aedeed6231bd8f21561f445231a21219d20f364243a57ae53","case_id":"nls3s_b001_0041"},{"case_commitment":"1b50979a54850d0e503fbed69c7f67c8079a194275696f01b849e65e09d93c54","case_id":"nls3s_b001_0042"},{"case_commitment":"f7333e4f1ca92ff5a3865de931cad836987499b3bb98ac45c1dcd6239af28464","case_id":"nls3s_b001_0043"},{"case_commitment":"eb2f616b5de39439f86ab14602614473b15549210bb3f3ad61e6a4f26288e7a7","case_id":"nls3s_b001_0044"},{"case_commitment":"f5bf390b62c529c13b170f9b303494ab8f1c3d10745b2e7b528ae951198303ae","case_id":"nls3s_b001_0045"},{"case_commitment":"02983a6f3b63cc9c7974169c698dbd8cc90b365db2347800b5729ca3d98caf27","case_id":"nls3s_b001_0046"},{"case_commitment":"7e7f257afc12d25d8bbfb454a6978286dbf1f4abc7d157195d48bc8bf1a86bd5","case_id":"nls3s_b001_0047"},{"case_commitment":"46a9fc6fa5e98fb7059da37bdedc0cb22bcddde87add7ff266faa738d20415b1","case_id":"nls3s_b001_0048"},{"case_commitment":"0fd342939417b07fe52c263a7ea967a03f26ae93a704f22e80d660f9313f651d","case_id":"nls3s_b001_0049"},{"case_commitment":"61fc4a0afedee9f926125d3c3ebe858a5ed0f86c5a0c9aa8ff2227566b61040e","case_id":"nls3s_b001_0050"},{"case_commitment":"df4888a3f1301380503d059b195167fe647a21c8b6568a118d69f425383b8091","case_id":"nls3s_b001_0051"},{"case_commitment":"7fd694a6fb8fc1ddce5cd2930f53fff8314baad2fb7fa0bf39ea37a8d7c6ce30","case_id":"nls3s_b001_0052"},{"case_commitment":"7ed426b1b964366f233455ecbfe1db8558cc70ec81e2f331becfe33411abf3db","case_id":"nls3s_b001_0053"},{"case_commitment":"8438839cace7b8e6e06eec65cc979810e49b200af775d25a92c34e2daaf906c6","case_id":"nls3s_b001_0054"},{"case_commitment":"773e7382694daa8137dadb3a91e18ce326d4afe56e98b9ae597c78f8f1c8b730","case_id":"nls3s_b001_0055"},{"case_commitment":"941ba01d42ec644ef2558d4d206f6388f9f9099bd1ed895f4f1be220f6164a03","case_id":"nls3s_b001_0056"},{"case_commitment":"10a041891be41cf95ed4ddcb0a10913151c8f9b63275aeea3dc2421586f40631","case_id":"nls3s_b001_0057"},{"case_commitment":"782c6b4f7d8bd277228aa49c8280be9f5965fc1a0d2f54bdd0072d0c15d602bb","case_id":"nls3s_b001_0058"},{"case_commitment":"27c2ec465fd0c89e8dab7666bbb48278e7275636d232a2246f213789d0c7ee98","case_id":"nls3s_b001_0059"},{"case_commitment":"afb4718cfd36c6fa2ab05ba753568176a489df5258743a84878e490db9b7adae","case_id":"nls3s_b001_0060"},{"case_commitment":"4ec70f5f4e1fd803584dd411413c71f664474971a5be329413866817d9c80125","case_id":"nls3s_b001_0061"},{"case_commitment":"94045f862d939089699e070fc6da8d0759405a9e1ba3d39686b32b5d31c4b928","case_id":"nls3s_b001_0062"},{"case_commitment":"3ab51f8c2cd36364db2f4a319642ba52feeb5998c6ebacda687a6bed7e6757ba","case_id":"nls3s_b001_0063"},{"case_commitment":"0c16cd98d86efe79527cb6d1da4b9a14b5ecad353313638fdb82689a3481f534","case_id":"nls3s_b001_0064"},{"case_commitment":"9112c140a88b7d8894458f17c7020fc0e5a7a624cfec7e401e0540c2b7b36eba","case_id":"nls3s_b001_0065"},{"case_commitment":"f805f4e3d771e4cbcd84be33e95447d37c147df97ab11e32fe4b83aa4e3d61b4","case_id":"nls3s_b001_0066"},{"case_commitment":"f07b53805d3715f484fd549a8c1a9a418dc3e484cd871b6bcd5114d312d9dbd3","case_id":"nls3s_b001_0067"},{"case_commitment":"299409b085d494cea86776c27b98e788b46cd0a79e0acfaf3e9d02bbd3499d7e","case_id":"nls3s_b001_0068"},{"case_commitment":"4f66b1e4cb928f7952b023fabc7eb425d8af3de2426a7fc3faf4f092531fefed","case_id":"nls3s_b001_0069"},{"case_commitment":"f981c9a6ad7bd8ee8b0de7da543cd7b05a5acd43e797625baebd44c467374774","case_id":"nls3s_b001_0070"},{"case_commitment":"76ce888cbff32fce8fc590ea70257548a9e744491ed957f63b7bfa0c48b9c013","case_id":"nls3s_b001_0071"},{"case_commitment":"c59d2cf830ef46d772ababed6d7b063f1f531544630b38bad0b7e3d6b0436c2f","case_id":"nls3s_b001_0072"},{"case_commitment":"be5ab2880e0dfa2c0fe7194a920241b81a3caa38b1c7c1df90babb59be3f9b1e","case_id":"nls3s_b001_0073"},{"case_commitment":"481e97fcad5796cdd274d5eb43357cd20521720e21fb4257ce489630185957d0","case_id":"nls3s_b001_0074"},{"case_commitment":"686b54ba98577e294f4e59f74c972a1c61ee0e5ada33cfe7be1805baee570380","case_id":"nls3s_b001_0075"},{"case_commitment":"488eee4dc1ed4fab754f38042dc13871f088bf265ca46c5eb00a50fa1ec0cb01","case_id":"nls3s_b001_0076"},{"case_commitment":"85482337deda962a3b87aad40e63a08b0d68ab7fc1390e8f7e0766b728a993c1","case_id":"nls3s_b001_0077"},{"case_commitment":"119554dcd63c8c21d6148d3c6e2346ef7c638dca7163f10260becb248224be21","case_id":"nls3s_b001_0078"},{"case_commitment":"0539bb55abf3892b2a4050907c8ab5f1d91606d4e0338961d1f9d4389ec1aace","case_id":"nls3s_b001_0079"},{"case_commitment":"cd5de55b76940213b74192a0eefd5044c25dc79554f914de8836267418620b72","case_id":"nls3s_b001_0080"},{"case_commitment":"bb6f2f7d294db98e7bd37fdfe0907da7fc5f01a858fd3f2b2d0f66f5fa23a0ff","case_id":"nls3s_b001_0081"},{"case_commitment":"4ff0817173e2f947e6ff53892b831dfcd0f7993dc310366c3e163980f2cbbcb0","case_id":"nls3s_b001_0082"},{"case_commitment":"86a9d6efd386fd3b492d4dedcd35ab50df717b63fe5c0bb4872b9e2e6f7da1f8","case_id":"nls3s_b001_0083"},{"case_commitment":"10a1a80f666908858b46a23cc0b8036377d93930cf13b1c68daa251473c10160","case_id":"nls3s_b001_0084"},{"case_commitment":"f09bb984e37e9f012e391f46c008ce99f13edb755be00148aa351bc26bdcc88c","case_id":"nls3s_b001_0085"},{"case_commitment":"61dd9e00346c3abfdd05ef67e504a91af11cad3df0d94ebd9f98c67ab4e25312","case_id":"nls3s_b001_0086"},{"case_commitment":"1d977080a6d355a475b35493